### ISSUE TITLE
smb

### ISSUE THREAD

**Issue by anasbousselham** [lum8rjack/ReplyAll#1]
Hi,
The SMB server (impacket) is still not triggering, even though the poisoning is working.
Any idea how to figure out that?
Thank you

**Comment by lum8rjack** [comment]
I can take another look at the code just to confirm it is working on my end since it has been a little while since the last update.

What OS are you running this on?
Are you running it as admin/root?

If you are able to, I would start by running responder to see if it's poisoning correctly. If possible you could also capture the network traffic to see what broadcast messages you are initially receiving and confirm the poisoners are responding correctly.

**Comment by anasbousselham** [comment]
Thank you for your response.
So my env. is linux debian and win10-11.

```bash
─$ sudo ./ReplyAll -interface ens18                                                                                                                  1 ↵
2025/01/17 16:16:37 [Poison mode] ReplyAll started listener on ens18 and responding with IP of 192.168.86.180                                             
2025/01/17 16:16:59 [MDNS] Request by 192.168.86.25 for _dosvc_tcp.local                          
2025/01/17 16:16:59 [MDNS] Poisoned wer sent to 192.168.86.25 for name _dosvc_tcp.local                                                                
2025/01/17 16:16:59 [MDNS] Request by 192.168.86.25 for Win-11_dosvc_tcp.local                                     
2025/01/17 16:16:59 [MDNS] Poisoned wer sent to 192.168.86.25 for name Win-11_dosvc_tcp.local                                                       
2025/01/17 16:17:00 [MDNS] Request by 192.168.86.25 for Win-11_dosvc_tcp.local                                                       
2025/01/17 16:17:00 [MDNS] Poisoned wer sent to 192.168.86.25 for name Win-11_dosvc_tcp.local                                                       
2025/01/17 16:17:00 [MDNS] Request by 192.168.86.25 for Win-11_dosvc_tcp.local                                     
2025/01/17 16:17:00 [MDNS] Poisoned wer sent to 192.168.86.25 for name Win-11_dosvc_tcp.local                                                       
2025/01/17 16:17:00 [MDNS] Request by 192.168.86.25 for _dosvc_tcp.local                                                                                  
2025/01/17 16:17:00 [MDNS] Poisoned wer sent to 192.168.86.25 for name _dosvc_tcp.local                                                                
2025/01/17 16:17:00 [MDNS] Request by 192.168.86.25 for Win-11_dosvc_tcp.local                                                       
2025/01/17 16:17:00 [MDNS] Poisoned wer sent to 192.168.86.25 for name Win-11_dosvc_tcp.local            
```


```bash
╰─$ sudo tcpdump -i ens18 -n "broadcast"                                                                                                                  
tcpdump: verbose output suppressed, use -v[v]... for full protocol decode                                                                                 
listening on ens18, link-type EN10MB (Ethernet), snapshot length 262144 bytes                                                                             
16:29:37.829856 f0:09:0d:cd:a7:9c > ff:ff:ff:ff:ff:ff, Realtek unknown type 0x25                    
16:29:38.574076 IP 192.168.86.41.9487 > 255.255.255.255.9478: UDP, length 40                                                                              
16:29:38.833494 f0:09:0d:cd:a7:9c > ff:ff:ff:ff:ff:ff, Realtek unknown type 0x25                     
16:29:39.831322 f0:09:0d:cd:a7:9c > ff:ff:ff:ff:ff:ff, Realtek unknown type 0x25                     
16:29:40.832138 f0:09:0d:cd:a7:9c > ff:ff:ff:ff:ff:ff, Realtek unknown type 0x25                     
16:29:41.833082 f0:09:0d:cd:a7:9c > ff:ff:ff:ff:ff:ff, Realtek unknown type 0x25                    
16:29:42.667637 ARP, Request who-has 192.168.86.36 (ff:ff:ff:ff:ff:ff) tell 192.168.8.100, length 46 
16:29:42.667691 ARP, Request who-has 192.168.86.32 (ff:ff:ff:ff:ff:ff) tell 192.168.8.100, length 46 
16:29:42.667692 ARP, Request who-has 192.168.86.70 (ff:ff:ff:ff:ff:ff) tell 192.168.8.100, length 46 
16:29:42.667693 ARP, Request who-has 192.168.86.43 (ff:ff:ff:ff:ff:ff) tell 192.168.8.100, length 46
16:29:42.667699 ARP, Request who-has 192.168.86.186 (ff:ff:ff:ff:ff:ff) tell 192.168.8.100, length 46
16:29:42.667700 ARP, Request who-has 192.168.86.25 (ff:ff:ff:ff:ff:ff) tell 192.168.8.100, length 46 
16:29:42.667700 ARP, Request who-has 192.168.86.33 (ff:ff:ff:ff:ff:ff) tell 192.168.8.100, length 46
16:29:42.667701 ARP, Request who-has 192.168.86.191 (ff:ff:ff:ff:ff:ff) tell 192.168.8.100, length 46
16:29:42.667702 ARP, Request who-has 192.168.86.44 (ff:ff:ff:ff:ff:ff) tell 192.168.8.100, length 46
16:29:42.667702 ARP, Request who-has 192.168.86.180 (ff:ff:ff:ff:ff:ff) tell 192.168.8.100, length 46
16:29:42.667706 ARP, Request who-has 0.0.0.0 (ff:ff:ff:ff:ff:ff) tell 192.168.8.100, length 46            
16:29:42.667706 ARP, Request who-has 192.168.86.194 (ff:ff:ff:ff:ff:ff) tell 192.168.8.100, length 46
16:29:42.667720 ARP, Request who-has 192.168.86.200 (ff:ff:ff:ff:ff:ff) tell 192.168.8.100, length 46
16:29:42.667721 ARP, Request who-has 0.0.0.0 (ff:ff:ff:ff:ff:ff) tell 192.168.8.100, length 46
16:29:42.667721 ARP, Request who-has 192.168.86.41 (ff:ff:ff:ff:ff:ff) tell 192.168.8.100, length 46
16:29:42.667722 ARP, Request who-has 192.168.86.1 (ff:ff:ff:ff:ff:ff) tell 192.168.8.100, length 46
16:29:42.836475 f0:09:0d:cd:a7:9c > ff:ff:ff:ff:ff:ff, Realtek unknown type 0x25
16:29:43.641335 IP 192.168.86.41.9999 > 255.255.255.255.9999: UDP, length 29     
```

**Comment by lum8rjack** [comment]
Are you able to run responder and see if it works or has the same issue?

**Comment by anasbousselham** [comment]
yep, that works great from my side.
